{
  "$schema": "./variables.schema.json",
  "fileKey": "E7LfRysny8V3qU24tv082i",
  "fileName": "Document",
  "exportedAt": "2026-10-23",
  "collections": [
    {
      "id": "VariableCollectionId:158:23",
      "name": "Oddkin · Component roles",
      "modes": [
        { "id": "158:0", "name": "Light" },
        { "id": "158:1", "name": "Dark" }
      ],
      "defaultModeId": "158:0",
      "variables": [
        {
          "id": "VariableID:158:71",
          "name": "border/width/default",
          "type": "FLOAT",
          "scopes": ["STROKE_FLOAT"],
          "codeSyntax": { "WEB": "var(--odd-border-width-default)" },
          "valuesByMode": {
            "Dark": { "alias": "Oddkin · Repository tokens/repo/border/width/default" },
            "Light": { "alias": "Oddkin · Repository tokens/repo/border/width/default" }
          }
        },
        {
          "id": "VariableID:158:72",
          "name": "border/width/strong",
          "type": "FLOAT",
          "scopes": ["STROKE_FLOAT"],
          "codeSyntax": { "WEB": "var(--odd-border-width-strong)" },
          "valuesByMode": {
            "Dark": { "alias": "Oddkin · Repository tokens/repo/border/width/strong" },
            "Light": { "alias": "Oddkin · Repository tokens/repo/border/width/strong" }
          }
        },
        {
          "id": "VariableID:158:70",
          "name": "card/padding",
          "type": "FLOAT",
          "scopes": ["GAP"],
          "codeSyntax": { "WEB": "var(--odd-card-padding)" },
          "valuesByMode": {
            "Dark": { "alias": "Oddkin · Repository tokens/repo/card/padding" },
            "Light": { "alias": "Oddkin · Repository tokens/repo/card/padding" }
          }
        },
        {
          "id": "VariableID:158:69",
          "name": "card/radius",
          "type": "FLOAT",
          "scopes": ["CORNER_RADIUS"],
          "codeSyntax": { "WEB": "var(--odd-card-radius)" },
          "valuesByMode": {
            "Dark": { "alias": "Oddkin · Repository tokens/repo/card/radius" },
            "Light": { "alias": "Oddkin · Repository tokens/repo/card/radius" }
          }
        },
        {
          "id": "VariableID:158:49",
          "name": "color/accent/decorative",
          "type": "COLOR",
          "scopes": ["FRAME_FILL", "SHAPE_FILL"],
          "codeSyntax": { "WEB": "var(--odd-color-accent-decorative)" },
          "valuesByMode": {
            "Dark": { "alias": "Oddkin · Repository tokens/repo/color/accent/decorative" },
            "Light": { "alias": "Oddkin · Repository tokens/repo/color/accent/decorative" }
          }
        },
        {
          "id": "VariableID:158:34",
          "name": "color/action/default",
          "type": "COLOR",
          "scopes": ["FRAME_FILL", "SHAPE_FILL"],
          "codeSyntax": { "WEB": "var(--odd-color-action-default)" },
          "valuesByMode": {
            "Dark": { "alias": "Oddkin · Repository tokens/repo/color/action/default/dark" },
            "Light": { "alias": "Oddkin · Repository tokens/repo/color/action/default/light" }
          }
        },
        {
          "id": "VariableID:158:35",
          "name": "color/action/hover",
          "type": "COLOR",
          "scopes": ["FRAME_FILL", "SHAPE_FILL"],
          "codeSyntax": { "WEB": "var(--odd-color-action-hover)" },
          "valuesByMode": {
            "Dark": { "alias": "Oddkin · Repository tokens/repo/color/action/hover/dark" },
            "Light": { "alias": "Oddkin · Repository tokens/repo/color/action/hover/light" }
          }
        },
        {
          "id": "VariableID:158:36",
          "name": "color/action/pressed",
          "type": "COLOR",
          "scopes": ["FRAME_FILL", "SHAPE_FILL"],
          "codeSyntax": { "WEB": "var(--odd-color-action-pressed)" },
          "valuesByMode": {
            "Dark": { "alias": "Oddkin · Repository tokens/repo/color/action/pressed/dark" },
            "Light": { "alias": "Oddkin · Repository tokens/repo/color/action/pressed/light" }
          }
        },
        {
          "id": "VariableID:158:39",
          "name": "color/border/default",
          "type": "COLOR",
          "scopes": ["FRAME_FILL", "SHAPE_FILL", "STROKE_COLOR"],
          "codeSyntax": { "WEB": "var(--odd-color-border-default)" },
          "valuesByMode": {
            "Dark": { "alias": "Oddkin · Repository tokens/repo/color/border/default/dark" },
            "Light": { "alias": "Oddkin · Repository tokens/repo/color/border/default/light" }
          }
        },
        {
          "id": "VariableID:158:40",
          "name": "color/border/strong",
          "type": "COLOR",
          "scopes": ["STROKE_COLOR"],
          "codeSyntax": { "WEB": "var(--odd-color-border-strong)" },
          "valuesByMode": {
            "Dark": { "alias": "Oddkin · Repository tokens/repo/color/border/strong/dark" },
            "Light": { "alias": "Oddkin · Repository tokens/repo/color/border/strong/light" }
          }
        },
        {
          "id": "VariableID:158:24",
          "name": "color/canvas",
          "type": "COLOR",
          "scopes": ["FRAME_FILL", "SHAPE_FILL"],
          "codeSyntax": { "WEB": "var(--odd-color-canvas)" },
          "valuesByMode": {
            "Dark": { "alias": "Oddkin · Repository tokens/repo/color/canvas/dark" },
            "Light": { "alias": "Oddkin · Repository tokens/repo/color/canvas/light" }
          }
        },
        {
          "id": "VariableID:158:43",
          "name": "color/danger/foreground",
          "type": "COLOR",
          "scopes": ["SHAPE_FILL", "TEXT_FILL", "STROKE_COLOR"],
          "codeSyntax": { "WEB": "var(--odd-color-danger-foreground)" },
          "valuesByMode": {
            "Dark": { "alias": "Oddkin · Repository tokens/repo/color/danger/foreground/dark" },
            "Light": { "alias": "Oddkin · Repository tokens/repo/color/danger/foreground/light" }
          }
        },
        {
          "id": "VariableID:158:44",
          "name": "color/danger/surface",
          "type": "COLOR",
          "scopes": ["FRAME_FILL", "SHAPE_FILL"],
          "codeSyntax": { "WEB": "var(--odd-color-danger-surface)" },
          "valuesByMode": {
            "Dark": { "alias": "Oddkin · Repository tokens/repo/color/danger/surface/dark" },
            "Light": { "alias": "Oddkin · Repository tokens/repo/color/danger/surface/light" }
          }
        },
        {
          "id": "VariableID:158:38",
          "name": "color/focus/ring",
          "type": "COLOR",
          "scopes": ["STROKE_COLOR"],
          "codeSyntax": { "WEB": "var(--odd-color-focus-ring)" },
          "valuesByMode": {
            "Dark": { "alias": "Oddkin · Repository tokens/repo/color/focus/ring/dark" },
            "Light": { "alias": "Oddkin · Repository tokens/repo/color/focus/ring/light" }
          }
        },
        {
          "id": "VariableID:499:2488",
          "name": "color/info/border",
          "type": "COLOR",
          "scopes": ["FRAME_FILL", "SHAPE_FILL", "TEXT_FILL", "STROKE_COLOR"],
          "codeSyntax": { "WEB": "var(--odd-color-info-border)" },
          "valuesByMode": {
            "Dark": { "alias": "Oddkin · Repository tokens/repo/color/info/border/dark" },
            "Light": { "alias": "Oddkin · Repository tokens/repo/color/info/border/light" }
          }
        },
        {
          "id": "VariableID:499:2485",
          "name": "color/info/foreground",
          "type": "COLOR",
          "scopes": ["FRAME_FILL", "SHAPE_FILL", "TEXT_FILL", "STROKE_COLOR"],
          "codeSyntax": { "WEB": "var(--odd-color-info-foreground)" },
          "valuesByMode": {
            "Dark": { "alias": "Oddkin · Repository tokens/repo/color/info/foreground/dark" },
            "Light": { "alias": "Oddkin · Repository tokens/repo/color/info/foreground/light" }
          }
        },
        {
          "id": "VariableID:499:2482",
          "name": "color/info/surface",
          "type": "COLOR",
          "scopes": ["FRAME_FILL", "SHAPE_FILL", "TEXT_FILL", "STROKE_COLOR"],
          "codeSyntax": { "WEB": "var(--odd-color-info-surface)" },
          "valuesByMode": {
            "Dark": { "alias": "Oddkin · Repository tokens/repo/color/info/surface/dark" },
            "Light": { "alias": "Oddkin · Repository tokens/repo/color/info/surface/light" }
          }
        },
        {
          "id": "VariableID:158:37",
          "name": "color/link",
          "type": "COLOR",
          "scopes": ["TEXT_FILL", "STROKE_COLOR"],
          "codeSyntax": { "WEB": "var(--odd-color-link)" },
          "valuesByMode": {
            "Dark": { "alias": "Oddkin · Repository tokens/repo/color/link/dark" },
            "Light": { "alias": "Oddkin · Repository tokens/repo/color/link/light" }
          }
        },
        {
          "id": "VariableID:332:72",
          "name": "color/neutral/border",
          "type": "COLOR",
          "description": "Mode-aware repository role color.neutral.border",
          "scopes": ["FRAME_FILL", "SHAPE_FILL", "TEXT_FILL", "STROKE_COLOR"],
          "valuesByMode": {
            "Dark": { "alias": "Oddkin · Repository tokens/repo/color/neutral/border/dark" },
            "Light": { "alias": "Oddkin · Repository tokens/repo/color/neutral/border/light" }
          }
        },
        {
          "id": "VariableID:332:70",
          "name": "color/neutral/foreground",
          "type": "COLOR",
          "description": "Mode-aware repository role color.neutral.foreground",
          "scopes": ["FRAME_FILL", "SHAPE_FILL", "TEXT_FILL", "STROKE_COLOR"],
          "valuesByMode": {
            "Dark": { "alias": "Oddkin · Repository tokens/repo/color/neutral/foreground/dark" },
            "Light": { "alias": "Oddkin · Repository tokens/repo/color/neutral/foreground/light" }
          }
        },
        {
          "id": "VariableID:332:71",
          "name": "color/neutral/surface",
          "type": "COLOR",